{
  "schema_version": 1,
  "item_id": "W1-01",
  "decision": "APPROVED",
  "content_sha256": "4c56f7a914493a7f8d5a8027edf9a58db8beffade1919aca75482f4dca3a0114",
  "review_packet_ref": "docs/brand/CONTENT_REVIEW_PACKET_V1.md",
  "target_channels": [
    "LinkedIn",
    "X"
  ],
  "reviewer": "human_user",
  "reviewed_at": "2026-09-12T20:09:36-03:00",
  "source": "explicit_human_approval",
  "notes": "Explicit human approval supplied by the user in ChatGPT on 2026-09-12 via the message “autorizo”. This approves the reviewed copy for the listed target channels only; it does not authorize publication."
}
